{
  "manifestVersion": "1.0",
  "id": "github-repo-monitor",
  "name": "GitHub repository monitor",
  "category": "Developer tools",
  "description": "React to a mention in GitHub issue and pull request comments, open a conversation with the surrounding context, and post the agent's reply back to GitHub.",
  "setupMode": "direct",

  "routes": [
    {
      "path": "/automations/new/github-repo-monitor",
      "page": "setup"
    }
  ],

  "capabilities": {
    "discovery": {
      "method": "GET",
      "path": "/v1/capabilities"
    },
    "requires": {
      "triggerKinds": ["event"],
      "eventSources": ["github"],
      "eventTypes": [
        "issue_comment.created",
        "pull_request_review_comment.created"
      ],
      "features": ["repoClone", "presetPrompt", "webhookDelivery"],
      "ready": true
    },
    "onUnsupported": {
      "behavior": "block",
      "message": "This deployment cannot receive GitHub webhook events, so the repository monitor is unavailable here. A scheduled automation that polls the GitHub API is the alternative."
    }
  },

  "requires": {
    "integrations": [
      {
        "id": "github",
        "reason": "Used to read issue and pull request comments and post replies.",
        "enforcement": "block"
      }
    ],
    "secrets": [
      {
        "key": "GITHUB_PERSONAL_ACCESS_TOKEN",
        "label": "GitHub personal access token",
        "help": "Needs read access to the repository and permission to comment on issues and pull requests.",
        "required": true
      }
    ],
    "onUnmet": {
      "behavior": "block",
      "message": "Connect GitHub and provide an access token before continuing."
    }
  },

  "form": {
    "fields": [
      {
        "name": "repository",
        "type": "repo-picker",
        "label": "Repository",
        "help": "The repository to watch for mentions.",
        "provider": "github",
        "required": true
      },
      {
        "name": "baseRef",
        "type": "text",
        "label": "Base branch",
        "help": "Branch checked out when the agent responds.",
        "default": "main",
        "required": true,
        "constraints": {
          "minLength": 1,
          "maxLength": 255
        }
      },
      {
        "name": "eventType",
        "type": "select",
        "label": "Respond to",
        "help": "Which GitHub comment event starts a conversation.",
        "default": "issue_comment.created",
        "required": true,
        "options": [
          {
            "value": "issue_comment.created",
            "label": "Comments on issues and pull requests"
          },
          {
            "value": "pull_request_review_comment.created",
            "label": "Pull request review comments only"
          }
        ]
      },
      {
        "name": "triggerPhrase",
        "type": "text",
        "label": "Trigger phrase",
        "help": "Only comments containing this phrase start a conversation. Matched case-insensitively. Quotes and backslashes are not allowed, because the phrase becomes part of the event filter expression.",
        "default": "@openhands",
        "required": true,
        "constraints": {
          "minLength": 2,
          "maxLength": 50,
          "format": "safeExpressionLiteral"
        }
      }
    ]
  },

  "validation": {
    "preflight": {
      "method": "POST",
      "path": "/v1/validate",
      "runOn": ["fieldBlur", "beforeSubmit"],
      "debounceMs": 400,
      "body": {
        "manifestId": "{{manifest.id}}",
        "endpoint": "/v1/preset/prompt",
        "draft": "{{submit.payload}}"
      }
    },
    "onInvalid": {
      "behavior": "blockSubmit",
      "errorTarget": "field",
      "errorMap": {
        "name": "repository",
        "repos[0].url": "repository",
        "repos[0].ref": "baseRef",
        "trigger.on": "eventType",
        "trigger.filter": ["triggerPhrase", "repository"],
        "prompt": ["triggerPhrase", "repository"]
      }
    }
  },

  "review": {
    "title": "Review before creating",
    "summary": [
      { "label": "Repository", "value": "{{form.repository}} ({{form.baseRef}})" },
      { "label": "Responds to", "value": "{{form.eventType}}" },
      { "label": "Trigger phrase", "value": "{{form.triggerPhrase}}" }
    ],
    "confirmLabel": "Create automation"
  },

  "submit": {
    "action": "automation.create",
    "endpoint": {
      "method": "POST",
      "path": "/v1/preset/prompt"
    },
    "payload": {
      "name": "Mention responder - {{form.repository}}",
      "prompt": "A comment in {{form.repository}} mentions '{{form.triggerPhrase}}'. Read the surrounding issue or pull request context from the event payload, then post a helpful reply as a comment on the same thread.",
      "repos": [
        {
          "url": "{{form.repository}}",
          "ref": "{{form.baseRef}}",
          "provider": "github"
        }
      ],
      "trigger": {
        "type": "event",
        "source": "github",
        "on": "{{form.eventType}}",
        "filter": "icontains(comment.body, '{{form.triggerPhrase}}') && glob(repository.full_name, '{{form.repository}}')"
      }
    },
    "onSuccess": {
      "behavior": "navigate",
      "to": "/automations/{{response.id}}"
    },
    "onError": {
      "behavior": "stayOnForm",
      "errorTarget": "field",
      "reuseErrorMap": true
    }
  },

  "analytics": {
    "consent": "required",
    "stages": [
      {
        "id": "setup_opened",
        "on": "route.entered",
        "properties": {
          "automation_id": "{{manifest.id}}",
          "setup_mode": "direct"
        }
      },
      {
        "id": "capabilities_checked",
        "on": "capabilities.resolved",
        "properties": {
          "automation_id": "{{manifest.id}}",
          "supported": "{{capabilities.supported}}"
        }
      },
      {
        "id": "setup_validated",
        "on": "validation.succeeded",
        "properties": {
          "automation_id": "{{manifest.id}}"
        }
      },
      {
        "id": "setup_submitted",
        "on": "submit.succeeded",
        "properties": {
          "automation_id": "{{manifest.id}}",
          "setup_mode": "direct",
          "trigger_kind": "event"
        }
      },
      {
        "id": "setup_failed",
        "on": "submit.failed",
        "properties": {
          "automation_id": "{{manifest.id}}",
          "setup_mode": "direct"
        }
      }
    ]
  }
}
