{
  "manifestVersion": "1.0",
  "id": "incident-retrospective-drafter",
  "name": "Incident retrospective drafter",
  "category": "Reliability",
  "description": "Collect incident chatter and issue updates, then draft a timeline and follow-up checklist.",
  "setupMode": "assisted",

  "routes": [
    {
      "path": "/automations/new/incident-retrospective-drafter",
      "page": "setup"
    }
  ],

  "capabilities": {
    "discovery": {
      "method": "GET",
      "path": "/v1/capabilities"
    },
    "requires": {
      "features": ["mcpTools", "conversationDispatch"],
      "ready": true
    },
    "onUnsupported": {
      "behavior": "block",
      "message": "This deployment cannot run automations that call MCP tools, so the incident retrospective drafter is unavailable here."
    }
  },

  "requires": {
    "integrations": [
      {
        "id": "slack",
        "reason": "Reads incident discussion and timestamps.",
        "enforcement": "block"
      },
      {
        "id": "linear",
        "reason": "Reads follow-up tickets, owners, and status.",
        "enforcement": "block"
      },
      {
        "id": "notion",
        "reason": "Publishes the drafted retrospective.",
        "enforcement": "warn"
      }
    ],
    "secrets": [],
    "onUnmet": {
      "behavior": "block",
      "message": "Connect Slack and Linear before continuing. Notion can be connected later during setup."
    },
    "onWarn": {
      "behavior": "continue",
      "message": "Notion is not connected yet. The agent will help you connect it or choose another destination."
    }
  },

  "form": {
    "note": "These answers start the conversation. Anything left blank is something the agent will ask about.",
    "fields": [
      {
        "name": "incidentChannel",
        "type": "text",
        "label": "Incident channel",
        "help": "The Slack channel where incidents are discussed.",
        "placeholder": "#incidents",
        "required": false,
        "constraints": {
          "maxLength": 100
        }
      },
      {
        "name": "linearTeam",
        "type": "text",
        "label": "Linear team",
        "help": "The team whose follow-up tickets belong in the retrospective.",
        "required": false,
        "constraints": {
          "maxLength": 100
        }
      },
      {
        "name": "notionDestination",
        "type": "text",
        "label": "Notion destination",
        "help": "Page or database where drafts should be published. Leave blank to decide during setup.",
        "required": false,
        "constraints": {
          "maxLength": 200
        }
      },
      {
        "name": "triggerPreference",
        "type": "select",
        "label": "How should it run?",
        "help": "A starting preference only. The agent confirms the exact trigger before creating anything.",
        "default": "undecided",
        "required": false,
        "options": [
          { "value": "undecided", "label": "Let the agent recommend one" },
          { "value": "scheduled", "label": "On a schedule" },
          { "value": "onIncidentLabel", "label": "When an incident is labelled" },
          { "value": "manual", "label": "Only when I run it" }
        ]
      },
      {
        "name": "notes",
        "type": "textarea",
        "label": "Anything else the agent should know?",
        "help": "Incident naming conventions, an existing retro template, who should be notified.",
        "required": false,
        "constraints": {
          "maxLength": 2000
        }
      }
    ]
  },

  "validation": {
    "onInvalid": {
      "behavior": "blockSubmit",
      "errorTarget": "field"
    }
  },

  "review": {
    "title": "Start the setup conversation",
    "note": "Setup finishes in a conversation with an agent. You can change any of this while you talk to it.",
    "emptyValueText": "the agent will ask",
    "summary": [
      { "label": "Incident channel", "value": "{{form.incidentChannel}}" },
      { "label": "Linear team", "value": "{{form.linearTeam}}" },
      { "label": "Publishes to", "value": "{{form.notionDestination}}" },
      { "label": "Preferred trigger", "value": "{{form.triggerPreference}}" }
    ],
    "confirmLabel": "Start setup conversation"
  },

  "submit": {
    "action": "conversation.start",
    "message": "/incident-retro:setup\n\nThe user supplied these starting points. Confirm each one, ask about anything left blank, then create the automation.\n\n- Incident channel: {{form.incidentChannel}}\n- Linear team: {{form.linearTeam}}\n- Notion destination: {{form.notionDestination}}\n- Preferred trigger: {{form.triggerPreference}}\n- Notes: {{form.notes}}\n\nStill undecided and required before creation: the incident identifier format and the approved Notion retrospective template.",
    "onSuccess": {
      "behavior": "navigate",
      "to": "/conversations/{{response.conversation_id}}"
    },
    "onError": {
      "behavior": "stayOnForm",
      "errorTarget": "form",
      "message": "The setup conversation could not be started. Nothing was created."
    }
  },

  "analytics": {
    "consent": "required",
    "stages": [
      {
        "id": "setup_opened",
        "on": "route.entered",
        "properties": {
          "automation_id": "{{manifest.id}}",
          "setup_mode": "assisted"
        }
      },
      {
        "id": "capabilities_checked",
        "on": "capabilities.resolved",
        "properties": {
          "automation_id": "{{manifest.id}}",
          "supported": "{{capabilities.supported}}"
        }
      },
      {
        "id": "setup_handed_off",
        "on": "submit.succeeded",
        "properties": {
          "automation_id": "{{manifest.id}}",
          "setup_mode": "assisted"
        }
      },
      {
        "id": "setup_failed",
        "on": "submit.failed",
        "properties": {
          "automation_id": "{{manifest.id}}",
          "setup_mode": "assisted"
        }
      }
    ]
  }
}
